state,Body Camera Laws
Texas,"Texas (SB 158) (2015) authorizes police departments to apply to the Office of the Governor for a grant to aid with the cost of implementing a body camera program. The law requires the governor's office to administer the grant program. Any law enforcement agency that receives a grant is required to match 25 percent of the grant money. Agencies that receive grant money must also report their costs to the Texas Commission on Law Enforcement. The commission must then aggregate all reports and submit them annually to the Governor’s office. The law also enables agencies to enter into interagency contracts for body cameras. It also requires law enforcement agencies that receive a grant to adopt a policy for the use of body-worn cameras. The law prohibits any policy from requiring an officer film their entire shift. In addition, the law requires training for police on the use of body cameras and prohibits officers from using their own personal equipment.

Texas (SB 1849) (2017) requires law enforcement agencies that adopt detailed written policies on racial profiling to also examine the feasibility of equipping every officer who regularly detains or stops motor vehicles with a body-worn camera.

The Department of Public Safety is required to adopt rules for providing funds or equipment to law enforcement agencies for the purpose of equipping police officers with body-worn cameras. The department must also collaborate with an institution of higher education to identify agencies that need funds or equipment to equip officers with body-worn cameras. In order to receive funds or equipment, the governing body where the agency is located must certify that the agency needs the funds or equipment. Upon receiving the funds or equipment, the governing body and agency must certify that the agency is using the body-worn cameras."
Tennessee,"Tennessee (SB 442) (2017) provides that law enforcement body-camera videos of certain incidents or situations shall be treated as confidential and not subject to public inspection. Those include videos of (1) minors, when taken within a school that serves any grades from kindergarten through grade 12, (2) The interior of a facility licensed under the state’s Mental Health and Substance Abuse and Intellectual and Developmental Disabilities code or the Health, Safety and Environmental Protection code or (3) The interior of a private residence that is not being investigated as a crime scene."
Utah,"Utah (SB 82) (2015) mandates that each police department have a body camera policy requiring an officer executing a warrant to wear a body camera when one is available. It also requires that every officer comply with their agency’s body camera policy. 

Utah (HB 300) (2016) requires law enforcement agencies that use body cameras to have a written policy governing their use. Policies at a minimum are required to address the security, storage, and maintenance of data collected from cameras. Officers are required to ensure the proper functioning of their equipment, to wear the camera so that it is clearly visible, to activate the camera prior to an encounter and to document when a body camera was used in an encounter. Officers can deactivate a camera when consulting with a fellow officer, during periods of inactivity, when conversing with a victim, witness or informant, or if an individual requests that the officer stops recording. Officers must document the reason for deactivating a camera. The law requires officers with a body-worn camera who enter a private residence to give notice, when reasonable, that a camera is in use by wearing it in a clearly visible manner; or by giving audible notice. The law also prohibits officers from using body cameras for personal use, making a personal copy of a recording, duplicating or distributing a recording except as authorized by law and altering or deleting a recording. Determining when a recording is a public record requires the government entity to balance personal privacy interests with any public interests served by disclosure. The law also requires that recordings taken within a home are considered private unless they depict the commission of a crime, record any encounter between law enforcement officer and a person that results in death or bodily injury, or the discharge of the officer’s weapon, record any encounter that is the subject of a complaint or a legal proceeding against a law enforcement officer or law enforcement agency.

Utah (HB 381) (2017) provides that any release of recordings made by an officer while on duty or acting in the officer's official capacity as a law enforcement officer shall be subject to the Government Records Access and Management Act. A person who requests access to the recordings may immediately appeal to a district court any denial of access for certain enumerated reasons.

Utah (HB 435) (2017) amends the Government Records Access and Management Act to classify an audio or video recording created by a body-worn camera in a health care setting as a protected record. Provides that an audio or video recording created by a body-worn camera that records sound or images inside a hospital or health care facility, inside a clinic of a health care provider, or inside a human service program, are protected records except for recordings that: (A) Depict the commission of an alleged crime. (B) Record any encounter between a law enforcement officer and a person that results in death or bodily injury, or includes an instance when an officer fires a weapon. (C) Record any encounter that is the subject of a complaint or a legal proceeding against a law enforcement officer or law enforcement agency. (D) Contain an officer-involved critical incident.  (E) Have been requested for reclassification as a public record by a subject or authorized agent of a subject featured in the recording. Provides that an officer may not activate a body-worn camera in a hospital, health care facility, human service program, or the clinic of a health care provider, except during a law enforcement encounter, and with providing proper notice.

Utah (HB 265) (2018) specifies that recordings made by law enforcement officers while wearing body-worn cameras may not be retained by private entities if the entity has the authority to prevent access or disclosure of the recording. This provision does not apply if a law enforcement agency is already under contract with an entity that has this authority but the contract may not be renewed when it lapses."
Vermont,"Vermont (20 § 2367) has a law that, in part, required a study of their use in conjunction with electronic control devices.

Vermont (SB 174) (2016) requires the Law Enforcement Advisory Board to develop legislation for a model body camera policy. The board must report on cost saving measures and funding opportunities. The model policy must address when police should wear a camera, when the camera should be turned on and when officers should explain why they turned their cameras on and off. It should also address when recordings should be exempt from public records AND how situations should be handled when video is unavailable."
Wyoming,"Wyoming (SB 32) (2017) defines ""peace officer recording"" as any audio or video data recorded by a peace officer on a camera or other device which is: (A) Provided to or used by the peace officer in the course of the officer performing official business. (B) Designed to be worn on the peace officer's body or attached to a vehicle. The law denies the public inspection of peace officer recordings, except that the custodian shall allow the right of inspection to law enforcement personnel or public agencies for the purpose of conducting official business or pursuant to a court order. The custodian may allow the right of inspection: (A) To the person in interest. (B) If the information involves an incident of deadly force or serious bodily injury. (C) In response to a complaint against a law enforcement personnel and the custodian of the information determines inspection is not contrary to the public interest. (D) In the interest of public safety."
Washington,"Washington (HB 2362) (2016) requires law enforcement agencies that use body-worn cameras to develop written policies. The policies must address when cameras should be activated and deactivated, how officer’s should respond when someone does not want to communicate with them on camera, how camera use and non-use should be documented, when an officer has to inform a member of the public they are being recorded, training requirements for officers to use cameras and data security rules.

Body-worn camera recording requests must specify a member of the public and law enforcement officer involved in the incident as well as the case number, date, time, and location of the incident in the requested recording. Body-worn camera recordings are exempt from public record disclosure to the extent it’s necessary to protect a person’s rights. Recordings are also exempt if they depict any areas of a medical facility, counseling, or therapeutic program office, the interior of a residence, a minor, a deceased person, or the identity of a victim or witness.

A person directly involved in an incident, and interested others including their attorney and civil rights boards, have the right to obtain the body worn camera recording. A law enforcement or corrections agency responding to requests from these individuals cannot require the requesting individual to pay costs of any redacting, altering, distorting, pixelating, suppressing, or otherwise obscuring any portion of a body worn camera recording.

The law also creates a task force to report on the use of body-worn cameras in health care facilities. The task force must report its findings by Dec. 1, 2017. The report must include, recommendations regarding costs assessed to requesters, policies adopted by agencies, retention and retrieval of data, model policies regarding body worn cameras.

Washington (SB 6408) (2018) expands body-worn camera policies to include all law enforcement agencies, not just those that had deployed the technology as of a certain date. Disclosing a body-worn camera recording that includes an intimate image is presumed to be “highly offensive to a reasonable person.” This legislation defines intimate image to include images of individuals engaged in sexual activity or an individual’s intimate body parts."
